{
  "consent": {
    "status": "local_review_only_no_transport",
    "statusSha256": "9a16443e9b193674f9f3aa12d1cd27fcbb33d77fe518ac69ed08a3f64368c27a",
    "version": "local-dry-run-v0.1"
  },
  "contract": {
    "backwardCompatibility": "none_regenerate_local_review_artifacts",
    "externalParticipantsAuthorized": false,
    "family": "telemetry-v0.1",
    "status": "draft_local_only_unfrozen",
    "statusSha256": "69952aae23afaaf7e1b9e7ede71559c641da5dabb2364c77754740873f39f8c0",
    "transportReady": false
  },
  "fieldContract": {
    "sha256": "203c3f191148b4b433b43d14a6cd24498aacf09c31ddf15d23d3a9ca30f99f25",
    "version": "telemetry-field-dictionary-v0.1"
  },
  "implementation": {
    "checkpointParserVersion": "codex-checkpoint-state-v0.2",
    "checkpointScanVersion": "codex-export-checkpoint-scan-v0.5",
    "exporterVersion": "0.3.0-draft.3",
    "packageName": "app-usagemonitor",
    "packageVersion": "0.1.24",
    "resourcePolicyVersion": "g1-r3-candidate-0.5"
  },
  "providerAdapters": {
    "anthropicClaudeCode": {
      "capabilities": {
        "quotaSnapshots": "implemented",
        "usageEvents": "implemented"
      },
      "sourceFormats": {
        "statusLine": {
          "adapterVersion": "quota-candidate-normalizer-v0.1",
          "parserVersion": "claude-statusline-v0.2",
          "sourceFormat": "claude-statusline-snapshot-v0.2",
          "status": "implemented"
        },
        "transcript": {
          "adapterVersion": "claude-transcript-usage-candidate-v0.2",
          "parserVersion": "claude-transcript-export-cursor-v0.2",
          "sourceFormat": "claude-code-transcript-jsonl",
          "status": "implemented"
        }
      },
      "status": "partial"
    },
    "openaiCodex": {
      "capabilities": {
        "quotaSnapshots": {
          "collector": "implemented",
          "rollout": "implemented"
        },
        "usageEvents": "implemented"
      },
      "sourceFormats": {
        "collectorQuota": {
          "adapterVersion": "quota-candidate-normalizer-v0.1",
          "parserVersion": "codex-collector-quota-candidate-v0.1",
          "sourceFormat": "codex-collector-jsonl-v0.3",
          "status": "implemented"
        },
        "rollout": {
          "adapterVersion": "codex-metadata-export-v6",
          "parserVersion": "codex-log-scan-v9",
          "sourceFormat": "codex-rollout-jsonl",
          "status": "implemented"
        }
      },
      "status": "implemented"
    }
  },
  "registry": {
    "sha256": "c6af6f120feb9e355d3516a37ebc93657b1eddd2033a95d6d7abf6f0e6915361",
    "version": "telemetry-v0.1-registry-2026-10-26.2"
  },
  "schemas": {
    "members": [
      {
        "id": "https://app-usagemonitor.local/schemas/telemetry-v0.1/activity-marker.schema.json",
        "name": "activity-marker.schema.json",
        "sha256": "b5f03f421bcfed6ff657a506bdf9ef7be1d9928d15733629067113cfdfa43f17"
      },
      {
        "id": "https://app-usagemonitor.local/schemas/telemetry-v0.1/bundle.schema.json",
        "name": "bundle.schema.json",
        "sha256": "556e14ebc808d95940ab94946d2f7b72ec59052b0912a38b64f0311805de35cc"
      },
      {
        "id": "https://app-usagemonitor.local/schemas/telemetry-v0.1/compatibility.schema.json",
        "name": "compatibility.schema.json",
        "sha256": "fc420f82554d8dcad491536ebc1e3c8736a5e308180329364c45937c6c4060f7"
      },
      {
        "id": "https://app-usagemonitor.local/schemas/telemetry-v0.1/privacy-receipt.schema.json",
        "name": "privacy-receipt.schema.json",
        "sha256": "a670e4be9d55e509746f56f1f071d07b7c1cb2296bacfeec2e9be928ee56db4d"
      },
      {
        "id": "https://app-usagemonitor.local/schemas/telemetry-v0.1/quota-snapshot.schema.json",
        "name": "quota-snapshot.schema.json",
        "sha256": "4caea9411e530e13bcf3e885cd8630e3a05c21c5f2b53b94fc99ec1654a32e78"
      },
      {
        "id": "https://app-usagemonitor.local/schemas/telemetry-v0.1/usage-event.schema.json",
        "name": "usage-event.schema.json",
        "sha256": "d26b6340104a7785078762cefc277481a6f29206908556a73a095c68612987e7"
      }
    ],
    "setSha256": "c1ee4635353fbca6905533232259fa01a78be85143c90bd378f77e11f8034f45"
  },
  "tupleVersion": "usage-export-compatibility-v0.1"
}
